{
  "kind": "skill-consent-record",
  "schemaVersion": "1.0.0",
  "protocolVersion": "1.6.0",
  "documentVersion": "1.0.0",
  "digestAlgorithm": "sha256",
  "canonicalization": "rfc8785",
  "documentDigest": "sha256:aaaaaaaaaaaaaaaaaaaaaaaaaaaaaaaaaaaaaaaaaaaaaaaaaaaaaaaaaaaaaaaa",
  "consentId": "consent-learning-plan",
  "skillId": "planr-plan",
  "subject": "learning",
  "decision": "granted",
  "recordedAt": "2026-08-30T00:00:00Z",
  "confirmation": {
    "kind": "guided-confirmation",
    "schemaVersion": "1.0.0",
    "protocolVersion": "1.2.0",
    "confirmationId": "GIC-consent01",
    "state": "confirmed",
    "actionId": "consent.learning",
    "sessionId": "GIS-session01",
    "command": "planr plan",
    "effect": "read-only",
    "providerUse": false,
    "confirmationScope": "Grant learning capture consent for the planning skill.",
    "confirmationDigest": "sha256:ffffffffffffffffffffffffffffffffffffffffffffffffffffffffffffffff",
    "projectIdentity": "sha256:1111111111111111111111111111111111111111111111111111111111111111",
    "projectHead": "sha256:2222222222222222222222222222222222222222222222222222222222222222",
    "configHead": "sha256:3333333333333333333333333333333333333333333333333333333333333333",
    "arguments": [],
    "destinations": [],
    "writes": [],
    "createdAt": "2026-08-30T00:00:00Z",
    "expiresAt": "2026-08-30T01:00:00Z",
    "confirmedAt": "2026-08-30T00:00:30Z",
    "confirmedBy": "human-owner"
  }
}
